{
  "bundleDir": "<bundle-dir>",
  "bundleSha256": null,
  "failures": [
    {
      "code": "manifestMissing",
      "message": "Missing manifest.json",
      "path": "<bundle-dir>/manifest.json"
    }
  ],
  "manifest": "manifest.json",
  "ok": false,
  "schema": "edgp.report.bundle.verification.v1",
  "summary": {
    "failures": 1,
    "reports": 0
  }
}
