{
  "bundleDir": "<bundle-dir>",
  "bundleSha256": "<bundleSha256>",
  "failures": [
    {
      "code": "sourceMissing",
      "message": "reports[1] referenced file is missing",
      "path": "<bundle-dir>/missing-source.json"
    }
  ],
  "manifest": "manifest.json",
  "ok": false,
  "schema": "edgp.report.bundle.verification.v1",
  "summary": {
    "failures": 1,
    "reports": 1
  }
}
