{
  "bundleDir": "<bundle-dir>",
  "bundleSha256": "<bundleSha256>",
  "failures": [
    {
      "code": "bundleDigestMismatch",
      "message": "bundleSha256 does not match canonical manifest payload",
      "path": "<bundle-dir>/manifest.json"
    }
  ],
  "manifest": "manifest.json",
  "ok": false,
  "schema": "edgp.report.bundle.verification.v1",
  "summary": {
    "failures": 1,
    "reports": 1
  }
}
